{
  "suite": "tblite",
  "case_id": "breast-cancer-mlflow",
  "plugin_ref": "main",
  "repo_commit": null,
  "passed": true,
  "wall_seconds": 1065.632757,
  "claude_turns": null,
  "codex_sessions": 5,
  "codex_reviews": 0,
  "manual_interventions": null,
  "prompt_log_pairs_complete": false,
  "ledger_errors": 0,
  "gate_passed": null,
  "report_score": 0.0,
  "token_usage": {
    "input_tokens": 2264622,
    "output_tokens": 53855,
    "cache_read_input_tokens": 2120375,
    "cache_creation_input_tokens": null,
    "total_tokens": 2318477,
    "cost_usd": null,
    "num_turns_reported": null
  },
  "external_score": {
    "benchmark": "tblite",
    "task_id": "breast-cancer-mlflow",
    "required_infra": "OpenThoughts-TBLite dataset and Harbor",
    "harbor_dataset": "openthoughts-tblite",
    "resolved": true,
    "verifier_exit": null,
    "score": 1.0,
    "verifier_rewards": {
      "reward": 1.0
    },
    "raw_result_path": "~/Projects/codex-orchestrator/.codex-orchestrator/runs/bench-real-infra/probe-work/breast-cancer-mlflow__main/harbor-jobs/breast-cancer-mlflow-9zp3_6dx/2026-07-03__02-31-11/breast-cancer-mlflow__iytn5zq/result.json",
    "token_usage": {
      "input_tokens": 2264622,
      "output_tokens": 53855,
      "cache_read_input_tokens": 2120375,
      "cache_creation_input_tokens": null,
      "total_tokens": 2318477,
      "cost_usd": null,
      "num_turns_reported": null
    },
    "token_breakdown": {
      "claude": {
        "input_tokens": 2264622,
        "output_tokens": 53855,
        "total_tokens": 2318477,
        "cost_usd": null
      },
      "gpt": {
        "input_tokens": 272585,
        "output_tokens": 10632,
        "total_tokens": 283217,
        "num_sessions": 2,
        "cost_usd": null
      },
      "combined": {
        "input_tokens": 2537207,
        "output_tokens": 64487,
        "total_tokens": 2601694
      }
    },
    "exception": {
      "exception_type": "AgentTimeoutError",
      "exception_message": "Agent execution timed out after 900.0 seconds",
      "exception_traceback": "Traceback (most recent call last):\n  File \"~/.local/share/uv/python/cpython-3.13.12-linux-x86_64-gnu/lib/python3.13/asyncio/tasks.py\", line 507, in wait_for\n    return await fut\n           ^^^^^^^^^\n  File \"~/Projects/codex-orchestrator/bench/harbor_agent.py\", line 473, in run\n    await super().run(\n        self._orchestrate_instruction(instruction), environment, context\n    )\n  File \"~/.local/share/uv/tools/harbor/lib/python3.13/site-packages/harbor/agents/installed/base.py\", line 60, in wrapper\n    return await fn(self, instruction, *args, **kwargs)\n           ^^^^^^^^^^^^^^^^^^^^^^^^^^^^^^^^^^^^^^^^^^^^\n  File \"~/.local/share/uv/tools/harbor/lib/python3.13/site-packages/harbor/agents/installed/claude_code.py\", line 1441, in run\n    await self.exec_as_agent(\n    ...<9 lines>...\n    )\n  File \"~/.local/share/uv/tools/harbor/lib/python3.13/site-packages/harbor/agents/installed/base.py\", line 418, in exec_as_agent\n    return await self._exec(\n           ^^^^^^^^^^^^^^^^^\n        environment, command, env=env, cwd=cwd, timeout_sec=timeout_sec\n        ^^^^^^^^^^^^^^^^^^^^^^^^^^^^^^^^^^^^^^^^^^^^^^^^^^^^^^^^^^^^^^^\n    )\n    ^\n  File \"~/.local/share/uv/tools/harbor/lib/python3.13/site-packages/harbor/agents/installed/base.py\", line 369, in _exec\n    result = await environment.exec(\n             ^^^^^^^^^^^^^^^^^^^^^^^\n    ...<5 lines>...\n    )\n    ^\n  File \"~/.local/share/uv/tools/harbor/lib/python3.13/site-packages/harbor/environments/docker/docker.py\", line 1025, in exec\n    return await self._compose_exec(\n           ^^^^^^^^^^^^^^^^^^^^^^^^^\n    ...<6 lines>...\n    )\n    ^\n  File \"~/.local/share/uv/tools/harbor/lib/python3.13/site-packages/harbor/environments/docker/docker.py\", line 1102, in _compose_exec\n    return await self._run_docker_compose_command(\n           ^^^^^^^^^^^^^^^^^^^^^^^^^^^^^^^^^^^^^^^\n    ...<4 lines>...\n    )\n    ^\n  File \"~/.local/share/uv/tools/harbor/lib/python3.13/site-packages/harbor/environments/docker/docker.py\", line 618, in _run_docker_compose_command\n    result = await self._collect_buffered_output(\n             ^^^^^^^^^^^^^^^^^^^^^^^^^^^^^^^^^^^^\n    ...<3 lines>...\n    )\n    ^\n  File \"~/.local/share/uv/tools/harbor/lib/python3.13/site-packages/harbor/environments/docker/docker.py\", line 648, in _collect_buffered_output\n    stdout_bytes, stderr_bytes = await process.communicate(input=stdin_data)\n                                 ^^^^^^^^^^^^^^^^^^^^^^^^^^^^^^^^^^^^^^^^^^^\n  File \"~/.local/share/uv/python/cpython-3.13.12-linux-x86_64-gnu/lib/python3.13/asyncio/subprocess.py\", line 201, in communicate\n    stdin, stdout, stderr = await tasks.gather(stdin, stdout, stderr)\n                            ^^^^^^^^^^^^^^^^^^^^^^^^^^^^^^^^^^^^^^^^^\n  File \"~/.local/share/uv/python/cpython-3.13.12-linux-x86_64-gnu/lib/python3.13/asyncio/subprocess.py\", line 181, in _read_stream\n    output = await stream.read()\n             ^^^^^^^^^^^^^^^^^^^\n  File \"~/.local/share/uv/python/cpython-3.13.12-linux-x86_64-gnu/lib/python3.13/asyncio/streams.py\", line 723, in read\n    block = await self.read(self._limit)\n            ^^^^^^^^^^^^^^^^^^^^^^^^^^^^\n  File \"~/.local/share/uv/python/cpython-3.13.12-linux-x86_64-gnu/lib/python3.13/asyncio/streams.py\", line 730, in read\n    await self._wait_for_data('read')\n  File \"~/.local/share/uv/python/cpython-3.13.12-linux-x86_64-gnu/lib/python3.13/asyncio/streams.py\", line 539, in _wait_for_data\n    await self._waiter\nasyncio.exceptions.CancelledError\n\nThe above exception was the direct cause of the following exception:\n\nTraceback (most recent call last):\n  File \"~/.local/share/uv/tools/harbor/lib/python3.13/site-packages/harbor/trial/trial.py\", line 434, in _run_agent_phase\n    await asyncio.wait_for(\n    ...<6 lines>...\n    )\n  File \"~/.local/share/uv/python/cpython-3.13.12-linux-x86_64-gnu/lib/python3.13/asyncio/tasks.py\", line 506, in wait_for\n    async with timeouts.timeout(timeout):\n               ~~~~~~~~~~~~~~~~^^^^^^^^^\n  File \"~/.local/share/uv/python/cpython-3.13.12-linux-x86_64-gnu/lib/python3.13/asyncio/timeouts.py\", line 116, in __aexit__\n    raise TimeoutError from exc_val\nTimeoutError\n\nThe above exception was the direct cause of the following exception:\n\nTraceback (most recent call last):\n  File \"~/.local/share/uv/tools/harbor/lib/python3.13/site-packages/harbor/trial/single_step.py\", line 71, in _run_agent\n    await self._run_agent_phase(\n    ...<4 lines>...\n    )\n  File \"~/.local/share/uv/tools/harbor/lib/python3.13/site-packages/harbor/trial/trial.py\", line 443, in _run_agent_phase\n    raise AgentTimeoutError(\n        f\"Agent execution timed out after {timeout_sec} seconds\"\n    ) from exc\nharbor.trial.errors.AgentTimeoutError: Agent execution timed out after 900.0 seconds\n",
      "occurred_at": "2026-07-03T02:48:29.347676"
    },
    "codex_sessions_spawned": 5,
    "real_orchestration": true,
    "orchestration_note": null
  }
}